doc,aba decides against community broadcasting licence
doc,act fire witnesses must be aware of defamation
doc,a g calls for infrastructure protection summit
doc,air nz staff in aust strike for pay rise
doc,air nz strike to affect australian travellers
doc,ambitious olsson wins triple jump
doc,antic delighted with record breaking barca
doc,aussie qualifier stosur wastes four memphis match
doc,aust addresses un security council over iraq
doc,australia is locked into war timetable opp
doc,australia to contribute 10 million in aid to iraq
doc,barca take record as robson celebrates birthday in
doc,bathhouse plans move ahead
doc,big hopes for launceston cycling championship
doc,big plan to boost paroo water supplies
doc,blizzard buries united states in bills
doc,brigadier dismisses reports troops harassed in
doc,british combat troops arriving daily in kuwait
doc,bryant leads lakers to double overtime win
doc,bushfire victims urged to see centrelink
doc,businesses should prepare for terrorist attacks
doc,calleri avenges final defeat to eliminate massu
doc,call for ethanol blend fuel to go ahead
doc,carews freak goal leaves roma in ruins
doc,cemeteries miss out on funds
doc,code of conduct toughens organ donation regulations
doc,commonwealth bank cuts fixed home loan rates
doc,community urged to help homeless youth
doc,council chief executive fails to secure position
doc,councillor to contest wollongong as independent
doc,council moves to protect tas heritage garden
doc,council welcomes ambulance levy decision
doc,council welcomes insurance breakthrough
doc,crean tells alp leadership critics to shut up
doc,dargo fire threat expected to rise
doc,death toll continues to climb in s korean subway
doc,dems hold plebiscite over iraqi conflict
doc,dent downs philippoussis in tie break thriller
doc,de villiers to learn fate on march 5
doc,digital tv will become commonplace summit
doc,direct anger at govt not soldiers crean urges
doc,dispute over at smithton vegetable processing plant
doc,dog mauls 18 month old toddler in nsw
doc,dying korean subway passengers phoned for help
doc,england change three for wales match
doc,epa still trying to recover chemical clean up costs
doc,expressions of interest sought to build livestock
doc,fed opp to re introduce national insurance
doc,firefighters contain acid spill
doc,four injured in head on highway crash
doc,freedom records net profit for third successive
doc,funds allocated for domestic violence victims
doc,funds allocated for youth at risk
doc,funds announced for bridge work
doc,funds to go to cadell upgrade
doc,funds to help restore cossack
doc,german court to give verdict on sept 11 accused
doc,gilchrist backs rest policy
doc,girl injured in head on highway crash
doc,gold coast to hear about bilby project
doc,golf club feeling smoking ban impact
doc,govt is to blame for ethanols unpopularity opp
doc,greens offer police station alternative
doc,griffiths under fire over project knock back
doc,group to meet in north west wa over rock art
doc,hacker gains access to eight million credit cards
doc,hanson is grossly naive over nsw issues costa
doc,hanson should go back where she came from nsw mp
doc,harrington raring to go after break
doc,health minister backs organ and tissue storage
doc,heavy metal deposits survey nearing end
doc,injured rios pulls out of buenos aires open
doc,inquest finds mans death accidental
doc,investigations underway into death toll of korean
doc,investigation underway into elster creek spill
doc,iraqs neighbours plead for continued un inspections
doc,iraq to pay for own rebuilding white house
doc,irish man arrested over omagh bombing
doc,irrigators vote over river management
doc,israeli forces push into gaza strip
doc,jury to consider verdict in murder case
doc,juvenile sex offenders unlikely to reoffend as
doc,kelly disgusted at alleged bp ethanol scare
doc,kelly not surprised ethanol confidence low
doc,korean subway fire 314 still missing
doc,last minute call hands alinghi big lead
doc,low demand forces air service cuts
doc,man arrested after central qld hijack attempt
doc,man charged over cooma murder
doc,man fined after aboriginal tent embassy raid
doc,man jailed over keno fraud
doc,man with knife hijacks light plane
doc,martin to lobby against losing nt seat in fed
doc,massive drug crop discovered in western nsw
doc,mayor warns landfill protesters
doc,meeting to consider tick clearance costs
doc,meeting to focus on broken hill water woes
doc,moderate lift in wages growth
doc,more than 40 pc of young men drink alcohol at
doc,more water restrictions predicted for northern tas
doc,more women urged to become councillors
doc,most highly educated live in nsw wa
doc,mp raises hospital concerns in parliament
doc,mp rejects ambulance levy claims
doc,mugabe to touch down in paris for summit
doc,national gallery gets all clear after
doc,nato gives green light to defend turkey
doc,nca defends aboriginal tent embassy raid
doc,new zealand imposes visa entry for zimbabwe
doc,no side effects for new whooping cough vaccine
doc,nsw govt under fire for holding back vegetation
doc,nsw opp defends claims of running race campaign
doc,nsw opp pledges 50m drought relief
doc,nt govt boosts nurse number with overseas intake
doc,nth koreans seek asylum at japanese embassy
doc,nursing student intake down
doc,oh brother your times up says ganguly senior
doc,omodei to stay in politics
doc,onesteel to invest 80m in whyalla steelworks
doc,opposition urged to help protect recherche bay
doc,orientation begins for uni students
doc,osullivan in world cross country doubt
doc,pagan says rule changes not necessary
doc,pair to face court over ayr murder
doc,patterson defends decision not to attend health
doc,patterson no show displays govts arrogance crean
doc,patterson snubs health meeting to avoid lions den
doc,peace agreement may bring respite for venezuela
doc,pienaar shines as ajax frustrate arsenal
doc,plan for second skatepark
doc,plan to encourage farmers into plantation timber
doc,png nurses strike after colleague raped on way to
doc,police cracking down on driver safety
doc,police defend aboriginal tent embassy raid
doc,policewomen accusations feature at federal crime
doc,probe launched into plane crash
doc,program to monitor forest harvested areas
doc,public urged to check gas cylinders
doc,public warned about phone scam
doc,qantas international crews to strike over pay
doc,qantas war plan to cut 2500 jobs outrages unions
doc,qr not planning northern route sackings
doc,questions public anger grows after korean subway
doc,rabbit control program on trial
doc,radioactive spill at wmcs olympic dam mine
doc,rain eases wheatbelt water woes
doc,reading go third in first division
doc,record amount for gladstone ventures
doc,refshauge wins defamation court case
doc,regulator to inspect gm canola trials
doc,report highlights container terminal potential
doc,resource stocks boost all ords
doc,restraint order issued against anti discrimination
doc,rfs rejects claim that act authorities spurned
doc,ricciuto undergoes surgery on injured ankle
doc,rice mill closures to put 300 out of work
doc,rsl angry about reports of troop harassment
doc,safety review begins after bushwalker death
doc,sa premier calls for action over river murray
doc,saudi arabians to stand trial over al qaeda
doc,saudi arabia tells arabs war on iraq inevitable
doc,search continues for victims in s korean subway
doc,second resolution on iraq expected shortly un
doc,shire offers assurances over finances
doc,six palestinians killed in gaza incursion
doc,slow recovery predicted for aust economy
doc,smoking bans hit tabcorp bottom line
doc,snowtown murder trial delayed
doc,states may be forced to label ethanol fuel
doc,stations to get fixed home phone service
doc,sterrey to steer sharks
doc,still no sign of missing fisherman
doc,stop changing the rules fans tell afl
doc,sugar industry plan to be revealed
doc,surge in new car sales in aust abs
doc,swiss challengers looking to future
doc,taipans placing future in publics hands
doc,talk of asian nuclear arms race unhelpful downer
doc,tasmanian scientists to search for east coast
doc,taylor denies calling on waugh to quit
doc,teen to face court over drug charges
doc,testing shows dioxin above drinking water standards
doc,thousands remember 61st anniversary of darwin
doc,unions to ask members to support public protests
doc,uni to continue tree disease study
doc,us british aircraft attack sth iraq target
doc,vff to buy stock feed pellets for fire affected
doc,vic local councils welcome single polling day
doc,victorian scientists honoured at awards
doc,vowles to retire at end of season
doc,wales coach accuses players of belittling red
doc,warne hearing set for friday
doc,webb favourite for ladies masters
doc,widnes abandon paul bid
doc,wildlife sanctuaries plan revealed
doc,williams says tight bowling key to warriors win
doc,wine chief bounces back from sacking
doc,worksafe probes potato harvester injuries
doc,15 dead in rebel bombing raid philippines army
doc,abattoir up for sale again
doc,academic upbeat about higher education review
doc,administrator to be appointed to land council
doc,aec to declare if nt to lose parliamentary seat
doc,amcor records solid profit result
doc,americas cup fourth race cancelled
doc,arsenal poised to swoop on beckham report
doc,aust drinking less alcohol smoking less study
doc,austeel eis release due soon nsw govt
doc,australian flag celebrates 100th birthday
doc,awu to hold meeting over port kembla jobs
doc,baby badly burnt in brisbane house fire
doc,bad weather might have caused iranian plane crash
doc,beckham leads as man u cut down depleted juve
doc,beware the standard alcoholic drink
doc,bilby dream to become reality
doc,brisbane sparkies head for 10 day strike
doc,britain tells nationals to leave iraq kuwait
doc,british high court overturns new blair asylum
doc,british magician to entomb himself in cheese
doc,bungle leaves doctor waiting to practise
doc,bushfire coronial inquiry winds up
doc,bush thanks nato for support on turkey
doc,call for ambos help in wake of funding changes
doc,canegrowers hope for late summer rain
doc,capriati hungry again in dubai
doc,celts underdogs for uefa clash oneill
doc,chambers vows to smash world mark
doc,charvis pays penalty as humphreys earns shock
doc,christmas is detention centre no go claims quashed
doc,claim defence spending priority over health nt
doc,claim education policy causing high indigenous
doc,claim new code should protect autopsy consent
doc,claim tas education policy causing high indigenous
doc,college to continue work experience
doc,concern act fire probe not covered by legal
doc,concorde makes emergency landing in canada
doc,coronial inquiry expected after hospital death
doc,council chief laments job advertising decision
doc,council general manager to step down
doc,council to offer vandalism reporting reward
doc,country racing clubs still hold tab fears
doc,court to rule on longford gas compo today
doc,cristal end eight match libertadores losing streak
doc,cuper slams inter bad boy recoba
doc,deportivo slip against buoyant swiss minnows basel
doc,distance swimmer maroney calls it quits
doc,dixon dismisses qantas monopoly claim
doc,downer warns iraq action could begin soon
doc,drought breaking rain may be months away
doc,drought impact may be more far reaching
doc,drought taking toll on insects
doc,early childhood development to receive research
doc,ellis webb well placed in ladies masters
doc,employee granted restraining order against a d
doc,england almost choke on burger king
doc,england call up morris for first cap
doc,epa to investigate radioactive spill in sa
doc,esso not responsible for economic losses from gas
doc,esso wins against class action for longford gas
doc,etienne agrees to tyson fight
doc,families confront korean president elect over
doc,fans join flower olonga in anti mugabe protest
doc,ferguson hails beckham in uniteds victory
doc,fewer australians being jailed abs
doc,fifa boss prepared to postpone matches for war
doc,firefighters told to not attend tip blazes
doc,fish cleaning facility plans announced
doc,flight attendant action wont affect bundaberg
doc,forest alliance rejects hindrance claims
doc,former bank worker pleads guilty to theft charges
doc,former treasurer charged with starting fire on sa
doc,forum puts focus on regional needs
doc,four nominate for nats charters towers preselection
doc,france drop merceron gelez to face scots
doc,french expedition site to be heritage protected
doc,fuel price jumps in newcastle
doc,fulham smash west brom with quickfire trio
doc,ganguly leads india to victory
doc,gartner wines to be wound up
doc,gippsland firefighters remain on guard
doc,govt canvassing ways to improve child development
doc,govt to work with rhh after coroners suicide report
doc,greenpeace calls for ban on gm canola
doc,greens dump anti terror kits on howards doorstep
doc,group airs truancy concerns
doc,groups praise outgoing opposition agriculture
doc,group to take over reef hq building
doc,hagan to blood rookies against penrith
doc,houllier backs owen to break rush scoring record
doc,howard steps up criticism of anti war protesters
doc,howard vows to stay on as pm until iraq crisis
doc,hussein says iraq doesnt want war with us
doc,illegal fishing hot spots identified
doc,immigration raid in melbourne draws flak
doc,impatience grows over water management plan
doc,indy meeting likely to include rain racing talks
doc,injuries threaten united finals bid
doc,interest sought in building stage one of bypass
doc,investigations underway into qantas skid
doc,investor in planned ethanol plant laments trial
doc,iran military plane crash kills 302
doc,iran plane crashes with at least 250 aboard tv
doc,iraqi use of human shields a war crime us
doc,italy remain unchanged for ireland clash
doc,kalgoorlie boulder crime rate declines
doc,kayakers rescued after second day of adventure
doc,kirwan sticks with winning formula for ireland
doc,korean books atp date with top seed roddick
doc,landholder contribution still under discussion
doc,lawyers allowed to visit manus is detention centre
doc,lawyers set to appeal mans sept 11 conviction
doc,lawyers to review case before any esso appeal
doc,lend leases posts 370 million loss
doc,lethal backs nine point rule change
doc,m5 airport tunnel remains closed after accident
doc,macarthurs kingfisher suffers minor damage
doc,man apologises for plane hijack
doc,man awaits sentencing over denmark murder
doc,man being questioned over qld backpacker death
doc,man charged over roxby downs plane incident
doc,man in hospital after stabbing attack
doc,man loses defamation compo bid
doc,man on murder charge refused bail
doc,man to face court over alleged hijack
doc,man to face court over attempted armed robbery
doc,man who whacked thatcher gets 3 months jail
doc,maroney calls it quits
doc,medal recognises islander war efforts
doc,meetings to consider glenelg river future
doc,melbourne man receives massive compo payout after
doc,mgladbach leave danger zone with home win
doc,mine rating challenge result expected in march
doc,miner exploring for nickel deposits
doc,molotov cocktail suspected in melb hotel fire
doc,more anti war rallies planned
doc,more land for noosa national park
doc,more teachers are at danger from students union
doc,more than 60 detained after immigration raid
doc,more women unlikely to join mens pga masters
doc,mosley ready for engine compromise
doc,motorists will avoid ethanol blended fuels labor
doc,mud crab business on the move
doc,murray meeting wouldnt detract from ministerial
doc,nats seek probe bushfires probe
doc,new boat takes to waterways
doc,new zealand to discover kenya fate on thursday
doc,no funding discussion until after nsw poll
doc,no penalties for church over damaged monument
doc,nsw coalition making magic pudding election
doc,nt govt announces community benefit grants
doc,offers roll in for classic holden
doc,oil prices hit new high
doc,oldfield to front court over one nation pre
doc,one nation pre selection hearing continues in nsw
doc,packer hands in licence as pistol investigation
doc,pakistani air force chief killed in air crash
doc,palaszczuk wont make disaster funds promise
doc,parks move to protect high conservation areas
doc,peace group denies members harassing soldiers
doc,people trapped after m5 pile up
doc,pilot makes emergency landing at adelaide airport
doc,players continue zimbabwe protest
doc,pm criticism of protesters disgraceful crean
doc,pm defends criticism of anti war protesters
doc,police continue probe into human remains find
doc,police find second cannabis crop
doc,police hope to gain an edge on weapons users
doc,police locate missing family of 6 after house
doc,police make arrests after drug raids
doc,police seek help over pay tv piracy
doc,police tax office to fight chop chop trade
doc,police wont rule out link between drug plantations
doc,politicians breeding publics anti troop sentiment
doc,pollock denies split in proteas camp
doc,population drift forces new federal boundaries
doc,powell to visit asia in bid to ease nth korean
doc,predictions of good wheatbelt rain
doc,probe launched into fatal police pursuit
doc,protesters condemn howard criticism of anti war
doc,protocols were followed in immigration raids
doc,public warned about snake handling dangers
doc,pumping continues at richmond after flooding
doc,qantas draws flak over redundancy talk
doc,qantas flags job cuts despite record profit
doc,qantas records 353 million profit
doc,qfvg upset over retail prices
doc,qld govt says new hospital on schedule
doc,qld nats close to deal with libs springborg
doc,racing club sneak a point in peru
doc,rain boosts farmers confidence
doc,rain may force aussie bowling change buchanan
doc,ram raid targets newsagency
doc,road funds to tackle flooding
doc,ronaldo puts real back in the race
doc,ruiz hat trick as guatemala rout nicaragua
doc,saff to gauge feelings on planned crown lands bill
doc,safin escude on rotterdam comeback trail
doc,sa govt defends moves to force fine defaulters to
doc,sa govt to appeal against fishing decision
doc,schmeichel set to miss arsenal trip
doc,school to reopen after paint fume scare
doc,scotland refuse to panic
doc,seaman injury crisis for arsenal
doc,self cloning crayfish threatens native species
doc,socceroos creep up world rankings
doc,solar cars to turn heads
doc,sporting task force planning begins
doc,start of americas cup race four delayed
doc,stone to stay on as federal liberal president
doc,sun needed for good downpour
doc,taipans win keeps play off dreams alive
doc,tas police to question injured man about house fire
doc,taxi driver to face sex trial
doc,tension increases after fighter strays into sth
doc,terror weapons pose minimal risk british expert
doc,thousands to visit dairy field days
doc,three israelis injured as hamas made rockets hit
doc,tnz shuffles pack as defeat looms
doc,tomasson gives milan narrow win over lokomotiv
doc,tough times ahead for water allocations
doc,tourism industry must be protected from iraq
doc,trial hears woman denied killing fiance
doc,triathletes back bris to gold coast bikeway
doc,truck roll destroys furniture
doc,turkey stands firm against us aid offer
doc,turkey still undecided over us aid for gulf attack
doc,union disunity over mccains enterprise agreement
doc,un security council ends two day open debate on
doc,us invited to talks with burmese military junta
doc,us launches homeland security ready campaign
doc,us markets remain jittery in shadow of war
doc,us tells turkey time running out for aid offer
doc,us to take no wto action against europe over ge
doc,uzbek journalist sentenced to seven years in jail
doc,verstappen pleased with new minardis track debut
doc,vic govt speaks out over rice mill closure claims
doc,wa fire crews battle bushfire at marangaroo
doc,war talk takes toll on all ords
doc,war with iraq could cost 120bn economists
doc,watkins jeered at education forum
doc,wa wine destined for us
doc,western power reveals power supply bid details
doc,wide bay economy growing stronger
doc,wine exporters urged to push ahead
doc,winemakers move considered loss for tas industry
doc,woman faces court over child prostitution
doc,yacht loses mast in trawler incident
doc,zimbabwe bars british reporter from world cup
doc,accc too timid in petrol price investigations
doc,action wanted to lower indigenous unemployment rate
doc,aec ruling to scrap federal seat hurts us the most
doc,aek shut out malaga to claim goalless draw
doc,allan guilty on cash charges
doc,allan unlikely to appeal fine
doc,ama airs hospital reform concerns
doc,ama delivers health concerns list to politicians
doc,andersson atwal miss record in malaysia
doc,antarctic rocks could aid global warming
doc,anz confident of growth in tough environment
doc,anz to pay more than 260 million to tax office
doc,arab states press for war crimes condemnation of
doc,at least 26 dead in us club fire
doc,at least 42 injured in rhode island nightclub fire
doc,aussie dollar continues its climb
doc,aust could be in top four al qaeda target list
doc,australia to withdraw bougainville peace monitors
doc,aust share market ends week in negative territory
doc,bartlett vows to block govt plans for sa nuclear
doc,beattie unaware of tree clearing funds hold up
doc,bedi labels murali a chucker
doc,belgian police recover stolen works
doc,bhp port kembla production restarts
doc,big guns back to business in the premier league
doc,blake paradorn upset in memphis
doc,bracks backs ruling on deans 50000 a year pension
doc,british govt clashes with high court over asylum
doc,british pop awards will be platform for iraq
doc,briton stabbed to death in bangkok
doc,brothel owner acquitted of hiring underage
doc,brothel owner fronts court after allegedly hiring
doc,burmas suu kyi sentenced to one day jail fined
doc,bushfires burn over 1m hectares
doc,cairns canberra grab nbl wins
doc,cairns injured in kiwi nightclub brawl
doc,cairns injured in nightclub brawl report
doc,call to scrap national plantation target
doc,candleholders recalled as fire risk
doc,carr off the hook over brogden debate pm
doc,celts sink 10 man stuttgart
doc,central qld park area expanded
doc,centrelink to offer drought counselling
doc,china to wage chemical war on chewing gum blobs
doc,chirac mugabe talk on sidelines of africa summit
doc,christmas island residents not aware of detention
doc,claim low oil inventory causing high petrol prices
doc,claims live sheep cattle exports threatening tas
doc,claims more rain will boost stock prices
doc,class action may cost esso 50m
doc,clinton cancels trip to india
doc,coalition promises to scrap anglers fee
doc,committal continues into goulburn jail riot
doc,costello unhappy he wasnt consulted by stone
doc,council approves poultry farm
doc,council awaits more rain
doc,council considers indigenous caravan park plan
doc,council elections planned for may
doc,council rejects combined field days stand idea
doc,council to change tree protection by law
doc,council to fund groundwater study
doc,counsel begin summing up at warnes doping hearing
doc,criminal charges pending in s korea subway probe
doc,crocs prove too good for bullets
doc,date set for bushfires coronial inquiry
doc,dean to receive lifetime parliamentary pension
doc,death spells end to record marriage
doc,demons thump tigers
doc,deportivo cali outclass sulky river plate
doc,deschamps chases old flame marseille
doc,disaster funds to allow shire to complete other
doc,dortmund ready to hound bayern
doc,downpour closes tourist roads
doc,drought impacting on roadworks
doc,drought predicted to have long lasting impact
doc,education dept considers rural concerns
doc,family court rejects bid to invalidate transsexual
doc,farmers celebrate good rain
doc,fears patterson hiding bad news tas health minister
doc,federal funds sought for wave studies
doc,fed govt considering appeal over transsexual
doc,firefighters win battle to contain beechford blaze
doc,fishers to meet minister over court ruling
doc,fishing group seeks action over pilchard imports
doc,flight attendants action likely to affect
doc,footy great gets behind indigenous rights campaign
doc,former socceroos coach thomson dies
doc,funeral held for cricket legend
doc,funk leads elkington in california
doc,gebrselassie plans world record comeback
doc,g g to witness church bell hand over
doc,gold coast gets us tourism assurances
doc,group concerned rain brings wrong impression
doc,group gets clearer understanding of farmers gm
doc,guga reaches buenos aires quarters
doc,health service speaks out over patient death
doc,hoddle st murderer granted right to seek judicial
doc,horse ride to re enact mt isa mine find
doc,howard repeats zimbabwe boycott call
doc,hundreds of triathletes to head for coffs
doc,hungarian thief makes amends by posts
doc,hyypia the hero as liverpool bounce back
doc,iaea to visit iran to assess nuclear program
doc,indian jailed for smuggling pakistani in suitcase
doc,indian players to retrace gandhi journey
doc,indonesia says australia travel warnings
doc,industrial action to impact on brisbane schools
doc,investigation underway into m5 pile up
doc,investigator probes sa hospital staff complaints
doc,jackson hits back at explosive british tv interview
doc,japanese tourist drowns in gold coast surf
doc,joblink issues statement over sacking
doc,keegan aiming to bring arsenal down to earth
doc,kenya awarded points for kiwi call off
doc,kylie minogues posterior is hit of the brits
doc,land council dismissed administrator appointed
doc,langer named one day player of year
doc,liverpool win but lazio held by krakow
doc,llewellyn not impressed by patterson so show
doc,longreach water restrictions to remain
doc,loose cannon afridi set for pakistan against
doc,lovenkrands dreaming of hampden return
doc,low water sparks boat ban for lake albert
