doc,male dna found on body of murdered schoolgirl
doc,man accused of selling bali bomb chemicals goes on
doc,man appears in court charged with stuttle murder
doc,man charged with stuttle murder
doc,man fails to overturn conviction over 1600yo bell
doc,man in hospital after receiving severe electric
doc,man in hospital after stabbing
doc,man jailed for fatally stabbing ex de facto
doc,man jailed for life over axe murder
doc,man to be re questioned over stuttle murder
doc,man to face court over fatal hit and run
doc,man u agreed deal with eriksson ferguson
doc,man who threatened melbourne water supply bailed
doc,map highlights potential river salinity problems
doc,mayor angry over mural vandalism
doc,mining giant calls for funding boost for native
doc,montgomery enters us indoor nationals
doc,more rain may delay tougher water restrictions
doc,more us troops to help hunt abu sayyaf rebels
doc,mp wants tank battalion rumours investigated
doc,mp welcomes police station announcement
doc,nardell mine closes as receiver appointed
doc,nauru appeals for help to keep nations airline
doc,new battle of britain looming in uefa cup
doc,newcastle city notch wins stallions draw with south
doc,new commercial mud crabbing restrictions planned
doc,new disability respite service
doc,n korea ducks nuclear talk at nam summit
doc,n korea warns it wont beg for peace
doc,no cost blowouts forecast for water treatment plan
doc,nsw coroner clears docs over death of toddler
doc,nsw graziers record heavy rainfall
doc,nsw opps drug free prison plan not new amery
doc,nursing home worker suspended
doc,olonga sacked by his club
doc,one million tickets sold for rugby world cup
doc,otago open super 12 with a win
doc,owners hesitant over northerlys overseas jaunt
doc,pair face court over machete attack
doc,palestinian killed at gaza strip crossing point
doc,patterson irresponsible with no show edmond
doc,patterson no show childish wa minister
doc,patterson says health meeting a waste of time
doc,petrol prices on the rise
doc,petrol will hit 120 if war breaks out ssa
doc,plan may include puckapunyal roo cull
doc,planning for intersection revamp begins
doc,pm accuses european countries of encouraging saddam
doc,pm defends protest comments
doc,pm has no choice but to stay on through iraq
doc,pm praises costello over leadership patience
doc,png governor general urges election unity
doc,police charge man over stabbing
doc,police continue investigating cannabis crops
doc,police stations face uncertainty
doc,powell calls on un to uphold responsibilities over
doc,push likely to seek more aged care workers
doc,push to extend fraser is world heritage listing
doc,qantas plane makes emergency landing
doc,qantas says it has no info as prime terrorist
doc,qantas urged to update security in shadow of
doc,qld govt rejects land acquisition claims
doc,racv not surprised by petrol rationing talk
doc,rail firm to assess workers needs
doc,rain brings stock losses
doc,rain causes chaos on melbourne roads
doc,rain expected to continue across act
doc,rainfall likely to clear on weekend
doc,rain in nsw a welcome relief but drought not over
doc,rain not enough to be drought breaking
doc,rain offers water supply boost
doc,rejuvenated tyson cured by cash injection
doc,residents get fire assurances
doc,retail sector airs trading hours review concerns
doc,romario jeered teams brawl as fluminense held
doc,round the world in no forget it
doc,ruddock commends australias traveller controls
doc,salinity experts map water catchments
doc,sa nt to lose seats in federal parliament
doc,sas soldier charged with misconduct while in e
doc,schumacher seeks more speed from less noise
doc,seaman set for ajax match
doc,search for better life pays off
doc,second us nightclub fire kills 10
doc,senators offer input into coast issues
doc,several dead in fire at rhode island nightclub
doc,shire says planning policy not compromised
doc,slapping paedophile to have arm amputated
doc,state territory health ministers arrive for meeting
doc,stolen wage report looks to improve indigenous
doc,strike expected to mean milk shortages
doc,strike may disrupt nsw milk supply
doc,study considers alternative crops for sugar regions
doc,study to probe snowy motorcycle crashes
doc,teachers shortage set to get worse report
doc,team mates send best wishes to warne
doc,telstra chief embarrassed with 1 billion writedown
doc,telstra punished after massive hong kong write down
doc,telstra still hurting from hk joint venture
doc,thieves target esperance cars
doc,timor sea treaty will be ratfied shortly martin
doc,troubled torino praying for a miracle
doc,tuckey laments gungahlin drive planning problems
doc,turkey delays vote on us troops
doc,turkey digs heels in us lobbies for support for
doc,turkey forces us to weigh up strategies
doc,union condemns qantass contract labour plan
doc,us asks indonesia to improve human rights record
doc,us boost troop numbers in philippines
doc,us chiropractor to address gold coast gathering
doc,us intelligence analyst found guilty of spying
doc,usq researchers prepare for move
doc,valencia sense victory in benitez v benitez
doc,vic govt gets farmers drought update
doc,victorian farmers hope rain will break drought
doc,victoria welcomes rain relief
doc,vinnicombe rejects mps freeway claims
doc,waratahs go down in super 12 opener
doc,war impact on exercise unknown
doc,warne decision to be made saturday
doc,warne dope hearing underway
doc,williams and mclaren plan to take fia to court
doc,wine and avocados drive mutton and wool off nz
doc,wisla hold lazio in six goal thriller
doc,woodgate told to stay away from elland road
doc,workers return to work on burrup
doc,youth group unhappy with appeal for carers
doc,86 confirmed dead after us nightclub fire
doc,act tourist attractions honoured at awards night
doc,adelaide break port hearts
doc,al qaeda members jailed for us uk terrorist plots
doc,arafats number two outlines proposed ceasefire
doc,athens risks turning into games disaster ioc
doc,australia urged to abandon zimbabwe world cup match
doc,black day for black caps
doc,blix orders destruction of iraqi missiles
doc,botched operation leaves teenager with brain damage
doc,brockovich takes new cancer crusade to court
doc,brogden accuses carr of fudging ambulance figures
doc,brumbies pip reds at ballymore
doc,cairns will play despite brawl
doc,call for australian human rights act
doc,canberra capitals win 2003 championship
doc,capitals flames vie for wnbl title
doc,captain refuses to ship wheat to iraq
doc,childrens rights overlooked advocate
doc,clp confident of winning lower house seat
doc,coria stuns nalbandian to reach argentina semis
doc,croatia launches bid for eu membership
doc,crusaders begin defence with win
doc,darwin police investigate attempted sex assault
doc,davies webb share masters lead
doc,death toll rises to 39 in us club blaze
doc,deputy says iraq is ready for dialogue with us
doc,despite rain govt says drought isnt over
doc,donald left out of bangladesh clash
doc,dumbledore replacement picked for potter film
doc,eagles down dockers despite mix up
doc,faldo withdraws from match play tournament
doc,farina pays tribute to thomson
doc,female cosmonauts keep feet on the ground
doc,ferrero escude hobble out of rotterdam
doc,ferreros rotterdam campaign ends in agony
doc,flash flooding keeps ses busy
doc,former star koen licks cats
doc,fourth cup race postponed again
doc,freeman splits with husband
doc,french african leaders support iraq inspections
doc,gebrselassie breaks two mile indoor wr
doc,gebrselassie breaks wr feofanova reaches new
doc,gurkhas discrimination case fails in uk court
doc,hearing adjourned over prison riot
doc,hip pain sidelines golf legend palmer
doc,howell leads by one in california
doc,hussain giles recalled for pakistan clash
doc,iaea begins iran nuclear assessment
doc,iraqs wheat comments political vaile
doc,jackson leads caps to back to back titles
doc,japan backs us campaign for fresh iraq vote
doc,johnson pittman excel in canberra
doc,kangaroos thump essendon hawks edge saints
doc,kookaburras force dutch to draw
doc,labor targets council golden handshakes
doc,lara jumps to warnes defence
doc,light winds delay fourth americas cup race
doc,likud party still without coalition partner
doc,long haul for graziers as rain breaks
doc,massa test drives championship winning ferrari
doc,metro recruiting women for bus driver positions
doc,newcastle secures third spot
doc,no confirmation of iraqi wheat order awb
doc,not greece lightning but olympic work under control
doc,nsw opp plans inquiry into community services
doc,nt health minister calls for meeting with cwealth
doc,ntini stars as bangladesh felled for 108
doc,ny mayor plays down terrorist attack speculation
doc,nz cricket to investigate durban nightclub brawl
doc,oil price hikes may weigh on rates decision
doc,one killed after us fuel barge explodes
doc,pair missing after us fuel barge explodes
doc,pearson routs aussie women
doc,petrol price hike compared to interest rate rise
doc,police coming off the beat oppn claims
doc,police investigate muswellbrook death
doc,police treat hunter valley death as murder
doc,powell leaves japan talks now for china
doc,powell starts asian tour for north korea talks
doc,proteas demolish bangladesh
doc,protesters afloat deliver peace message to pm
doc,public less concerned with environment statistics
doc,qld takes gong in aust tourism awards
doc,rain brings relief for act farmers
doc,rain falls on drought ravaged eastern states
doc,recoba handed three match champions ban
doc,results of first aids vaccine trial to be released
doc,robo deer takes bullet for justice
doc,roddick heads all us semis in memphis
doc,saddam ponders un edict to scrap missiles
doc,sad note as esteemed music educator dies
doc,sa govt blocks glenelg high rise apartments
doc,sampras withdraws from arizona replaced by hewitt
doc,sa police closing in on schoolgirl killer
doc,seaman rested for maine road visit
doc,searchers fear 18 dead after china ferry sinks
doc,selectors to announce warne replacement soon
doc,seles to face henin hardenne in dubai final
doc,shop owner on trial accused over bali bomb
doc,s korea subway staff face kill charges over fire
doc,smigun takes out nordic skiing world championship
doc,st helens win super league season opener
doc,stormers slaughter sharks
doc,stuttle family welcomes travel offer
doc,sunrace heads into gloomy final day
doc,sun shines on rmit entry in eco car race
doc,taipans stay alive cannons dodge bullets
doc,tas relay to raise money for cancer council
doc,teenagers stabbed in cbd fight
doc,toll rises in us club fire
doc,turkey poised for iraq deal with us
doc,two killed in wa motorbike collision
doc,uk warns of final phase in iraq stand off
doc,ulster militants declare ceasefire
doc,us authorities confirm 95 killed in club fire
doc,us duo ensures all american semi finals
doc,us nightclub fire death toll hits 39
doc,us prosecutors win slave labour case in samoa
doc,us stocks rise following positive iraqi comments
doc,vic govt calls for volunteers in state clean up
doc,wa opp says police will be taken off the beat
doc,warne to appeal 12 month ban
doc,weather change saves white beach shacks
doc,woods remains in the hunt
doc,worker electrocuted during piggery repairs
doc,accused people smuggler to face darwin court
doc,act will struggle with public housing demand mla
doc,alice forum to discuss indigenous education issues
doc,alinghi fuming at another cancellation
doc,at least 14 die as bus tumbles into greece river
doc,aussies arrive in zimbabwe
doc,barca deportivo real shine in spain
doc,bayern open 10 point gap
doc,bevan not frustrated by lack of opportunities
doc,blair puts case on iraq to pope
doc,bradman baggy green expected to fetch 200000
doc,britain to rally support for new un resolution on
doc,brown claims french landing site could be tassies
doc,butchers defended over beef prices
doc,calls for peaceful iraqi resolution
doc,cambodian pm denies political emergency
doc,carpark shooting sparks adelaide manhunt
doc,carr plans 200m anti drug campaign
doc,cat lovers march for romes sacred strays
doc,cats claw dogs
doc,cats claw dogs pies swoop on blues
doc,coalition launches ads ahead of election
doc,colombian rebels demand rescuers back off
doc,consumers wear cost of trolley loss
doc,council denies revenue raising over parking fees
doc,court finds man guilty of gross ingratitude
doc,cricketers association says warne ban too harsh
doc,csl defends acquisition investigation
doc,darwin cleared to play next super 12 match
doc,davies takes ladies masters
doc,davison plunders record century
doc,deadly fire at us rock club whos at fault
doc,dems to block govts spending cut moves
doc,differences see beazley stay a backbencher
doc,downer expects un to back new iraq edict
doc,downer pushes urgent us talks with n korea
doc,downer unmoved by iraqi wheat decision
doc,drought doom turns to flood gloom
doc,end protest or face the axe zimbabwe players told
doc,england deserves cup favouritism oneill
doc,england keep grand slam dreams alive
doc,england punishes disappointing pakistan
doc,fake crocs scare off flamingos
doc,fickle weather again holds up cup racing
doc,firefighters to continue containment efforts near
doc,five palestinians die in army crackdown
doc,flower may play in australia report
doc,forensic teams struggle to identify us club fire
doc,former un ambassador criticises howard remarks
doc,freeman expected to race in melbourne
doc,gatecrashers blamed for violence at bali thank you
doc,geelong fights for ring road funding
doc,govt paper discusses preservation of adelaide
doc,gunners demolish city as man u stumble
doc,hampshire chairman calls for review of crickets
doc,hampshire wants warne once ban is done
doc,hard work steals craftsmens identities
doc,hayden focusing on cricket not politics
doc,henin hardenne outlasts seles in dubai thriller
doc,hill stars as tigers claim charity cup
doc,hockeyroos save best till last
doc,hotels association to fight smoking ban
doc,howell extends la lead
doc,hussain hails special england performance
doc,iaea says iraqi cooperation improving
doc,iraqi minister says protests prompt wheat decision
doc,kings regain top spot
doc,lions roll swans
doc,man charged after bashing nightclub door with
doc,man charged over ormiston attack
doc,man charged with attempted murder after stabbing
doc,man fights for life after stabbing
doc,man stabbed to death in melbourne brawl
doc,maroney makes one last swim
doc,medicare offices busier as bulk billing dips
doc,mirnyi slays federer to reach rotterdam final
doc,missile issue can be resolved with less pressure
doc,monster surf sweeps woman to death
doc,more magic from martina
doc,natasha spat wont destroy us dems
doc,nataus
doc,newton predicted 2060 armageddon reports
doc,new un resolution would give hussein days downer
doc,nine killed in violence outside karachi mosque
doc,nsw greens call for parties to show their hand
doc,nt uni receives cwealth literacy grant
doc,odriscoll captures record as ireland downs italy
doc,oil and water does mix okay
doc,opec pledges oil will flow despite war
doc,patterson says states should make an offer
doc,pearson says bureaucracy fails indigenous welfare
doc,perth tigers giants notch nbl wins
doc,pilot dies in ultralight plunge
doc,polanski gets best director cesar for the pianist
doc,police arrest pair attacked with bricks bottles
doc,police search for men after shooting
doc,pope urges blair to avert war
doc,psg crash to defeat despite ronaldinho gem
doc,rain still needed in central west qld
doc,raymond defends memphis title
doc,research turns spotlight on binge drinking
doc,roddick wants no dent in atp crown
doc,s african weapons inspectors to iraq
doc,sa police investigate fatal road crash
doc,searchers retrieve ultralight pilots body
doc,search intensifies for missing pilot
doc,search to begin for missing pilot
doc,ses busy after flash floods in north west nsw
doc,sharks steal glory in perth
doc,sherpa plans worlds highest cyber cafe byo oxygen
doc,storms whip nsw coast as northern floods steady
doc,strikers rout kingz
doc,strikers rout kingz united down knights
doc,tail rescues struggling wa
doc,tamworth flooding may cost millions
doc,teacher student guidelines need modifying mp
doc,teenager dies after transplant mix up
doc,tendulkar blazes century in big total
doc,territory on search for raw comedy talent
doc,third time lucky for canberra unis brisbane campus
doc,tight security to greet cricketers in zimbabwe
doc,tourists cry foul over spilt milk
doc,tropfest turns tarpfest but show will go on
doc,turkey signals go ahead for us troops
doc,tyson destroys etienne in less than a minute
doc,un vote on iraq soon after march 7 powell
doc,us spain draft second un resolution
doc,us to put new resolution before un
doc,warne appeal to delay naming of replacement
doc,warne will be back pollock
doc,warnings of water contaminiation after recent rain
doc,wa struggling in one day final
doc,waugh expected to play in one day final
doc,waugh leads blues to one day title
doc,weapons experts denounce us intelligence on iraq
doc,yemen chopper crash kills eight troops
doc,94 dead in china earthquake
doc,academic considers indigenous culture role in
doc,adelaide man charged with firearm offences
doc,ajax lose ground after utrecht defeat
doc,all ords jumps 33 points higher
doc,alp chooses charlestown candidate
doc,amino levels linked to malaria treatment research
doc,anti french jokes censored broadcaster complains
doc,asa welcomes court ruling on chairman
doc,at least five killed in factional afghan fighting
doc,awb defends grain freight spot price tendering
doc,beef prices set to rise
doc,bhp billiton reveals 19pc profit downturn
doc,blokes peel off pants for peace
doc,bomb alert delays domestic flights by philippine
doc,boulami set to be banned iaaf source
doc,boy almost drowns after being swept down storm
doc,bradman baggy green may go on tour
doc,britain concerned about reports of iraqi missiles
doc,building industry set for a shake up
doc,cabinet meets to balance budget priorities
doc,canberra steps up tourist campaign
doc,carr considers clarence battle
doc,celtic still on for four trophies
doc,chavez blasts media as violence continues
doc,civilian killed as gunmen attack minibus in east
doc,claim more than 20 diamond miners murdered in congo
doc,claims of new evidence in an unsolved double murder
doc,clean coal technology still years away
doc,coastal grazing boom lifts property prices
doc,combined approach tackles grasshoppers
doc,committee to offer aged care warning
doc,community bank shares trading shows little change
doc,community cleans up after drenching
doc,community flocks to use waste transfer station
doc,conference to focus on tuna fishery
doc,council hosts farewell for mp
doc,council resists eba roster pressure
doc,customs house restoration opened
doc,dam water levels still critically low
